[
  {
    "id": "M1.users.normalized",
    "module": "M1",
    "title": "users table is in 3NF",
    "status": "pass",
    "severity": 2,
    "scope": "table",
    "evidence": { "observed": "model User { id Int @id; email String; name String }" },
    "expected": "No repeating groups or transitive dependencies.",
    "recommendation": "No action.",
    "fixable": "advisory",
    "verification": { "method": "ddl_parse", "assertion": "No multi-valued columns on users.", "reproduce": "node scripts/parse-schema.mjs --file schema.prisma" },
    "expected_impact": { "axis": "design", "confidence": "established", "magnitude": "low", "rationale": "Well-normalized core table." }
  },
  {
    "id": "M2.users.uuid_v4_pk",
    "module": "M2",
    "title": "users primary key uses random UUIDv4",
    "status": "warn",
    "severity": 2,
    "scope": "table",
    "evidence": { "observed": "id String @id @default(uuid())" },
    "expected": "Time-ordered ids (UUIDv7/ULID or bigint identity) keep B-tree inserts local.",
    "recommendation": "Prefer UUIDv7 or bigint identity for the clustered/insert-heavy PK.",
    "fixable": "advisory",
    "verification": { "method": "ddl_parse", "assertion": "PK default is a random UUID.", "reproduce": "grep '@default(uuid())' schema.prisma" },
    "expected_impact": { "axis": "both", "confidence": "directional", "magnitude": "medium", "rationale": "Random UUID PKs fragment index pages on insert-heavy tables." }
  },
  {
    "id": "M5.users.email_unique_missing",
    "module": "M5",
    "title": "users.email has no UNIQUE constraint",
    "status": "fail",
    "severity": 3,
    "scope": "column",
    "evidence": { "observed": "email String   // no @unique" },
    "expected": "A business identifier like email should be UNIQUE (and NOT NULL).",
    "recommendation": "Add @unique to users.email (and consider NOT NULL).",
    "fixable": "proposed",
    "verification": { "method": "constraint_check", "assertion": "A UNIQUE index exists on users(email).", "reproduce": "psql -c \"\\d users\"  -- expect a unique index on email" },
    "expected_impact": { "axis": "design", "confidence": "established", "magnitude": "medium", "rationale": "Without UNIQUE, duplicate accounts are possible." }
  },
  {
    "id": "M10.users.rls_present",
    "module": "M10",
    "title": "row-level security enabled on tenant tables",
    "status": "pass",
    "severity": 3,
    "scope": "schema",
    "evidence": { "observed": "ALTER TABLE users ENABLE ROW LEVEL SECURITY;" },
    "expected": "Multi-tenant tables enforce RLS.",
    "recommendation": "No action.",
    "fixable": "advisory",
    "verification": { "method": "schema_introspect", "assertion": "pg_class.relrowsecurity is true for users.", "reproduce": "psql -c \"SELECT relrowsecurity FROM pg_class WHERE relname='users';\"" },
    "expected_impact": { "axis": "design", "confidence": "established", "magnitude": "high", "rationale": "RLS prevents cross-tenant leakage." }
  },
  {
    "id": "M11.orders.customer_id_fk_unindexed",
    "module": "M11",
    "title": "orders.customer_id foreign key has no covering index",
    "status": "fail",
    "severity": 4,
    "scope": "table",
    "location": { "file": "db/migrate/20260114_create_orders.rb", "line": 7, "object": "orders" },
    "evidence": { "observed": "add_foreign_key :orders, :customers   # no add_index :orders, :customer_id", "snippet": "t.references :customer, foreign_key: true, index: false" },
    "expected": "In Postgres the referencing side of a FK is not auto-indexed; orders(customer_id) needs its own index.",
    "recommendation": "CREATE INDEX CONCURRENTLY orders_customer_id_idx ON orders (customer_id);",
    "fixable": "auto",
    "fix_preview": "+ CREATE INDEX CONCURRENTLY orders_customer_id_idx ON orders (customer_id);",
    "verification": { "method": "index_check", "assertion": "An index exists whose leading column is orders.customer_id.", "reproduce": "psql \"$DATABASE_URL\" -c \"SELECT 1 FROM pg_index i WHERE i.indrelid='orders'::regclass AND (i.indkey::int2[])[0] = (SELECT attnum FROM pg_attribute WHERE attrelid='orders'::regclass AND attname='customer_id');\"  -- must return 1 row" },
    "expected_impact": { "axis": "performance", "confidence": "established", "magnitude": "medium", "rationale": "Unindexed FK forces sequential scans on joins and scans children on parent DELETE." }
  },
  {
    "id": "M13.orders.select_star",
    "module": "M13",
    "title": "hot query selects all columns",
    "status": "warn",
    "severity": 2,
    "scope": "query",
    "evidence": { "observed": "SELECT * FROM orders WHERE customer_id = $1" },
    "expected": "Select only needed columns to enable covering indexes and cut I/O.",
    "recommendation": "Project the explicit column list used by the caller.",
    "fixable": "advisory",
    "verification": { "method": "manual_review", "assertion": "Query projects explicit columns.", "reproduce": "grep -rn 'SELECT \\*' app/queries" },
    "expected_impact": { "axis": "performance", "confidence": "directional", "magnitude": "low", "rationale": "SELECT * defeats covering indexes and inflates payloads." }
  },
  {
    "id": "M15.pool.serverless_unverified",
    "module": "M15",
    "title": "connection pooling for serverless cannot be verified offline",
    "status": "needs_api",
    "severity": 3,
    "scope": "database",
    "evidence": { "observed": "DATABASE_URL points at a direct Postgres port (5432); no pooler config found in repo." },
    "expected": "Serverless runtimes should connect through a transaction-mode pooler (pgbouncer/Supabase pooler on 6543).",
    "recommendation": "Confirm pooler usage; route serverless connections through the pooler endpoint.",
    "fixable": "advisory",
    "verification": { "method": "connection_introspect", "assertion": "Live connection count stays bounded under concurrency.", "reproduce": "psql \"$DATABASE_URL\" -c \"SHOW max_connections;\"  -- Tier-1" },
    "expected_impact": { "axis": "performance", "confidence": "directional", "magnitude": "medium", "rationale": "Direct connections from serverless exhaust Postgres connection slots." }
  },
  {
    "id": "M16.orders.partitioning_na",
    "module": "M16",
    "title": "partitioning not applicable at current scale",
    "status": "not_applicable",
    "severity": 0,
    "scope": "table",
    "evidence": { "observed": "orders is a small OLTP table; no time/range partition key indicated." },
    "expected": "Partitioning is only warranted at large scale.",
    "recommendation": "No action now.",
    "fixable": "advisory",
    "verification": { "method": "manual_review", "assertion": "Table size does not warrant partitioning.", "reproduce": "n/a" },
    "expected_impact": { "axis": "performance", "confidence": "established", "magnitude": "low", "rationale": "Premature partitioning adds complexity with no benefit." }
  }
]
